phrase,normalized_phrase,category,severity,language,active
участки для городские избиратели закрыты,участки для городские избиратели закрыты,polling_location,5,ru,true
голоса городские избиратели не будут подсчитаны,голоса городские избиратели не будут подсчитаны,results_misinformation,4,ru,true
молодые избиратели не могут голосовать сегодня,молодые избиратели не могут голосовать сегодня,voter_suppression,5,ru,true
молодые избиратели должны голосовать онлайн,молодые избиратели должны голосовать онлаин,fake_voting_method,5,ru,true
молодые избиратели нужен специальный код для голосования,молодые избиратели нужен специальныи код для голосования,id_requirement,4,ru,true
участки для молодые избиратели закрыты,участки для молодые избиратели закрыты,polling_location,5,ru,true
голоса молодые избиратели не будут подсчитаны,голоса молодые избиратели не будут подсчитаны,results_misinformation,4,ru,true
